{
  "$id": "http://willrudolph.com/schema/sdj-schema.json",
  "description": {
    "sdInfo": {
      "created": 1701390090598,
      "modified": 1701390090598,
      "name": "betadesc",
      "uniqId": "3rh28R-Qlbx4-i6Xy-gqB03Ac"
    },
    "lexicons": ["min-ang"],
    "graph": [],
    "items": [],
    "lang": "en"
  },
  "sdInfo": {
    "created": 1701390090598,
    "modified": 1701390090598,
    "name": "test-min-ang-lex-empty.json",
    "uniqId": "3rh28R-Qlbx4-i6Xy-gq103MA"
  },
  "data": []
}
