{
  "$id": "http://willrudolph.com/schema/sdj-schema.json",
  "description": {
    "sdInfo": {
      "created": 1701390090598,
      "modified": 1701390090598,
      "name": "descName",
      "uniqId": "3rh28R-Qlbx4-i6Xy-gqB03MA"
    },
    "graph": [],
    "items": [],
    "lang": "en"
  },
  "sdInfo": {
    "created": 1701390090598,
    "modified": 1701390090598,
    "name": "desc-test-a.json",
    "uniqId": "4rh28R-Qlbx4-i6Xy-g3B03MA"
  },
  "data": []
}
