{
  "$id": "http://willrudolph.com/schema/sdj-schema.json",
  "description": {
    "sdInfo": {
      "created": 0,
      "modified": 0,
      "name": "descName",
      "uniqId": "000000-00000-0000-0000000"
    },
    "graph": [],
    "items": []
  },
  "sdInfo": {
    "created": 1701390090598,
    "modified": 1701390090598,
    "name": "sdj-blank-good.json",
    "uniqId": "000000-00000-0000-0000000"
  },
  "data": []
}
